{
  "$schema": "../schema/findings.schema.json",
  "file_kind": "findings",
  "version": "2026.10.0",
  "status": "draft",
  "licence": "CC-BY-4.0",
  "attribution": "Margdarshak content pack, team Chanakya (Nestiq Private Limited), 2026",
  "notes": "DEBRIEF_SPEC §2 taxonomy for all ten games with the §9 template texts (debrief.<findingId>.lacked / .could, and .how for positives). Numbers enter only through {{fact:key}} placeholders whose keys are the finding's facts; formatted values carry their own units (§5.2), so templates never type units after a placeholder. Every rule a finding may cite is listed, verified or not; allowlists filter to ai_citable. All template text is a draft awaiting two-person review; Hindi awaits native review; Golden Hour text also awaits medical sign-off.",
  "findings": [
    {
      "finding_id": "NAZ_LATE_RESPONSE",
      "game_id": "nazar",
      "polarity": "negative",
      "trigger": "any hazard scored with late_s ≥ 0.5",
      "severity": "min(1, mean_late_s / 3)",
      "critical": false,
      "facts": [
        {
          "key": "late_s",
          "kind": "seconds"
        },
        {
          "key": "speed_kmh",
          "kind": "kmh"
        },
        {
          "key": "metres",
          "kind": "metres"
        },
        {
          "key": "hazard_type",
          "kind": "enum"
        },
        {
          "key": "clip_ordinal",
          "kind": "ordinal"
        }
      ],
      "skill": {
        "id": "SK-M18",
        "resolution": "per_hazard_type"
      },
      "rule_ids": ["RR-HVY-001", "RR-JCT-001", "RR-PED-001", "RR-SRF-001"],
      "rule_resolution": "per_hazard_type",
      "rulepack_refs": [],
      "drill_ids": [],
      "drill_pattern": {
        "template": "DR-NAZ-OCCL-{hazard_type}",
        "fact_key": "hazard_type"
      },
      "template_only": false,
      "templates": {
        "lacked": {
          "en": "You spotted {{fact:hazard_type}} {{fact:late_s}} late. At {{fact:speed_kmh}} that is {{fact:metres}} further on.",
          "hi": "आपने {{fact:hazard_type}} को {{fact:late_s}} देर से पहचाना; {{fact:speed_kmh}} पर यह {{fact:metres}} आगे है।"
        },
        "could": {
          "en": "Watch for the early clue: feet under a bus, a door edge, a wheel turning. Cover the brake as soon as you see it.",
          "hi": "पहले संकेत पर नज़र रखें: बस के नीचे पैर, दरवाज़े का किनारा, मुड़ता पहिया। दिखते ही ब्रेक पर उँगलियाँ रखें।"
        }
      },
      "review_status": "draft",
      "hi_review_status": "pending_native_review",
      "medical_review_required": false
    },
    {
      "finding_id": "NAZ_MISSED_HAZARD",
      "game_id": "nazar",
      "polarity": "negative",
      "trigger": "≥ 1 hazard with 0 points",
      "severity": "min(1, 0.4 + 0.2 × missed_count)",
      "critical": false,
      "facts": [
        {
          "key": "missed_count",
          "kind": "times"
        },
        {
          "key": "hazard_type",
          "kind": "enum"
        },
        {
          "key": "clip_ordinal",
          "kind": "ordinal"
        }
      ],
      "skill": {
        "id": null,
        "resolution": "per_hazard_type"
      },
      "rule_ids": ["RR-HVY-001", "RR-JCT-001", "RR-PED-001", "RR-SRF-001"],
      "rule_resolution": "per_hazard_type",
      "rulepack_refs": [],
      "drill_ids": [],
      "drill_pattern": {
        "template": "DR-NAZ-OCCL-{hazard_type}",
        "fact_key": "hazard_type"
      },
      "template_only": false,
      "templates": {
        "lacked": {
          "en": "In clip {{fact:clip_ordinal}}, {{fact:hazard_type}} slipped past without a tap. This happened {{fact:missed_count}} in the set.",
          "hi": "क्लिप {{fact:clip_ordinal}} में {{fact:hazard_type}} बिना टैप के निकल गया। इस सेट में ऐसा {{fact:missed_count}} हुआ।"
        },
        "could": {
          "en": "Keep your eyes moving: ahead, the sides, then the mirrors. Tap as soon as something starts to change.",
          "hi": "नज़र घुमाते रहें: आगे, किनारे, फिर शीशे। जैसे ही कुछ बदलना शुरू हो, टैप करें।"
        }
      },
      "review_status": "draft",
      "hi_review_status": "pending_native_review",
      "medical_review_required": false
    },
    {
      "finding_id": "NAZ_REPEATED_TYPE_MISS",
      "game_id": "nazar",
      "polarity": "negative",
      "trigger": "same hazard_type missed or late in ≥ 2 clips",
      "severity": "0.8",
      "critical": false,
      "facts": [
        {
          "key": "hazard_type",
          "kind": "enum"
        },
        {
          "key": "times",
          "kind": "times"
        }
      ],
      "skill": {
        "id": null,
        "resolution": "per_hazard_type"
      },
      "rule_ids": ["RR-HVY-001", "RR-JCT-001", "RR-PED-001", "RR-SRF-001"],
      "rule_resolution": "per_hazard_type",
      "rulepack_refs": [],
      "drill_ids": [],
      "drill_pattern": {
        "template": "DR-NAZ-OCCL-{hazard_type}",
        "fact_key": "hazard_type"
      },
      "template_only": false,
      "templates": {
        "lacked": {
          "en": "You were late or missed {{fact:hazard_type}} {{fact:times}}. This one is worth a focused drill.",
          "hi": "इस तरह के ख़तरे ({{fact:hazard_type}}) पर आप {{fact:times}} देर से रहे या चूके। इस पर अलग से अभ्यास करना फ़ायदेमंद है।"
        },
        "could": {
          "en": "Learn the setting where this hazard starts, so you are already looking there before it happens.",
          "hi": "जान लें कि यह ख़तरा किस जगह से शुरू होता है, ताकि होने से पहले ही आपकी नज़र वहाँ हो।"
        }
      },
      "review_status": "draft",
      "hi_review_status": "pending_native_review",
      "medical_review_required": false
    },
    {
      "finding_id": "NAZ_PATTERN_CLICK",
      "game_id": "nazar",
      "polarity": "negative",
      "trigger": "pattern rule voided ≥ 1 clip",
      "severity": "min(1, 0.6 + 0.1 × pattern_clips)",
      "critical": false,
      "facts": [
        {
          "key": "pattern_clips",
          "kind": "times"
        },
        {
          "key": "taps_in_1s",
          "kind": "number"
        }
      ],
      "skill": {
        "id": "SK-M18",
        "resolution": "fixed"
      },
      "rule_ids": [],
      "rule_resolution": "none",
      "rulepack_refs": [],
      "drill_ids": ["DR-NAZ-CALM"],
      "drill_pattern": null,
      "template_only": false,
      "templates": {
        "lacked": {
          "en": "Rapid tapping cancelled a clip {{fact:pattern_clips}}, with {{fact:taps_in_1s}} taps inside a single second.",
          "hi": "लगातार तेज़ टैप से क्लिप {{fact:pattern_clips}} रद्द हुई; एक ही सेकंड में {{fact:taps_in_1s}} टैप हुए।"
        },
        "could": {
          "en": "Tap once when you see a hazard start, then wait. Extra taps don't earn points.",
          "hi": "ख़तरा शुरू होता दिखे तो एक बार टैप करें, फिर रुकें। ज़्यादा टैप से अंक नहीं मिलते।"
        }
      },
      "review_status": "draft",
      "hi_review_status": "pending_native_review",
      "medical_review_required": false
    },
    {
      "finding_id": "NAZ_FALSE_ALARMS",
      "game_id": "nazar",
      "polarity": "negative",
      "trigger": "practice: fa_per_min ≥ 4 [D]",
      "severity": "min(1, fa_per_min / 10)",
      "critical": false,
      "facts": [
        {
          "key": "fa_per_min",
          "kind": "rate_per_min"
        }
      ],
      "skill": {
        "id": "SK-M18",
        "resolution": "fixed"
      },
      "rule_ids": [],
      "rule_resolution": "none",
      "rulepack_refs": [],
      "drill_ids": ["DR-NAZ-QUIET"],
      "drill_pattern": null,
      "template_only": false,
      "templates": {
        "lacked": {
          "en": "You tapped when nothing was developing, about {{fact:fa_per_min}}.",
          "hi": "जब कुछ नहीं बन रहा था तब भी आपने टैप किया, लगभग {{fact:fa_per_min}}।"
        },
        "could": {
          "en": "Wait until a road user starts to move into your path, then tap. Calm, timely taps score best.",
          "hi": "तब तक रुकें जब तक कोई आपके रास्ते की ओर बढ़ना शुरू न करे, फिर टैप करें। शांत और सही समय पर किया टैप सबसे अच्छा है।"
        }
      },
      "review_status": "draft",
      "hi_review_status": "pending_native_review",
      "medical_review_required": false
    },
    {
      "finding_id": "NAZ_EARLY_TAPS",
      "game_id": "nazar",
      "polarity": "negative",
      "trigger": "learn: ≥ 2 early_taps",
      "severity": "0.3",
      "critical": false,
      "facts": [
        {
          "key": "early_taps",
          "kind": "times"
        }
      ],
      "skill": {
        "id": null,
        "resolution": "per_hazard_type"
      },
      "rule_ids": [],
      "rule_resolution": "none",
      "rulepack_refs": [],
      "drill_ids": [
        "DR-NAZ-OCCL-BUS_STOP_PEDESTRIAN",
        "DR-NAZ-OCCL-DOOR_OPENING",
        "DR-NAZ-OCCL-AUTO_CUT_IN",
        "DR-NAZ-OCCL-WRONG_SIDE_2W",
        "DR-NAZ-OCCL-CATTLE_ANIMAL",
        "DR-NAZ-OCCL-CHILD_SCHOOL",
        "DR-NAZ-OCCL-PEDESTRIAN_MEDIAN",
        "DR-NAZ-OCCL-VEHICLE_PULLING_OUT",
        "DR-NAZ-OCCL-TRUCK_LEFT_TURN",
        "DR-NAZ-OCCL-JUNCTION_EMERGING",
        "DR-NAZ-OCCL-OVERTAKING_ONCOMING",
        "DR-NAZ-OCCL-PARKED_VEHICLE_HIDDEN",
        "DR-NAZ-OCCL-CYCLIST",
        "DR-NAZ-OCCL-SURFACE_HAZARD",
        "DR-NAZ-OCCL-OTHER"
      ],
      "drill_pattern": null,
      "template_only": false,
      "templates": {
        "lacked": {
          "en": "In learn mode you tapped before the hazard began {{fact:early_taps}}.",
          "hi": "लर्न मोड में आपने ख़तरा शुरू होने से पहले ही {{fact:early_taps}} टैप किया।"
        },
        "could": {
          "en": "Look for the moment a road user starts to change speed or direction; that is when to tap.",
          "hi": "उस पल को पहचानें जब कोई अपनी रफ़्तार या दिशा बदलना शुरू करे; टैप तभी करें।"
        }
      },
      "review_status": "draft",
      "hi_review_status": "pending_native_review",
      "medical_review_required": false,